{"id": "WS-171", "title": "OPS-003 المصروف المتكرر المحلي — تنفيذ كامل موجات (عقد ٤١)", "status": "CLAIMED", "items": ["OPS-003"], "branch": "ops-003/recurring-expense-system", "base_sha": "16b4c8afafb4b091bdb6e1ce5f8208bff39f5145", "areas": ["expenses", "recurrence", "storage-concurrency", "finance", "presentation"], "contracts": ["docs/contracts/41-recurring-expense-reminders-contract.md", "docs/contracts/05-financial-p0-policies.md", "docs/contracts/06-financial-event-prototype-contract.md", "docs/contracts/27-guided-financial-entry-contract.md", "docs/contracts/23-general-financial-event-correction-boundary-proposal-v1.md", "docs/contracts/34-correction-history-trail-contract.md", "docs/contracts/39-export-envelope-integrity-contract.md"], "agent": "ZAI / Super Z OPS-003 complete implementation session 2026-09-21", "pr": null, "started_at": "2026-09-21T10:35:00+03:00", "updated_at": "2026-09-21T11:20:00+03:00", "next_action": "تنفيذ الموجات A–E (عقد+دومين → تخزين/ترحيل/تصدير → خدمة/حتمية/عكس → RTL UX → إغلاق وPR) على الفرع المخصص ثم التوقف عند PR-ready لقرار دمج المالك.", "notes": ["حزمة تصميم المالك الموافقة (2026-09-21) تحسم د١–د٦ وتصرح بالتنفيذ الكامل موجات A–E على فرع واحد طويل من رأس main المتحقق 16b4c8af.", "حدود صريحة: لا دمج تلقائي (توقف عند PR-ready لقرار مالك)، لا دفع مباشر إلى main، لا حذف فروع، لا مستودع Documents، لا نشر.", "رفع مخطط/تصدير ٣٥→٣٦/٢٧→٢٨ مرخص ضمن حزمة التصمين (د١) مع الفرق الثلاثي الموثق في PR واحد.", "تقييم الموجة 7 المحفوظ (WS-170 DEFERRED) يبقى سجلًا تاريخيًا؛ هذا Claim جديد مستقل وفق نظام Operations Control v2."], "status_history": [{"status": "CLAIMED", "changed_at": "2026-09-21", "actor": "claim:ws-171", "reason": "Claim تنفيذي جديد للبند OPS-003 بعد صدور قرارات المالك د١–د٦ واعتماد عقد ٤١؛ من رأس main المتحقق 16b4c8afafb4b091bdb6e1ce5f8208bff39f5145."}], "migration_baseline": false}
