{
 "id": "WS-177",
 "title": "Financial Roadmap Wave 5 — FIN-006 canonical per-catalog-item recorded result (identity keying, status separation, visible exclusions)",
 "status": "IN_REVIEW",
 "items": [
  "FIN-006"
 ],
 "branch": "feat/fin-006-catalog-item-result-20260923",
 "base_sha": "83197b1c214f25a400ed81f88823d2221fd5ae83",
 "areas": [
  "application/finance/recurring-work",
  "presentation/catalog-readings"
 ],
 "contracts": [
  "docs/contracts/15-catalog-reference-prototype-contract.md",
  "docs/contracts/17-contribution-break-even-short-cash-g5-contract.md",
  "docs/contracts/05-financial-p0-policies.md",
  "docs/contracts/03-cost-snapshot-contract.md"
 ],
 "agent": "ZAI / Super Z Financial Roadmap controlled execution session 2026-09-23",
 "pr": 0,
 "started_at": "2026-09-23T04:00:00+03:00",
 "updated_at": "2026-09-23",
 "next_action": "راجع PR الموجة 5 ثم ادمج وتحقق على SHA الدمج في main قبل VERIFIED.",
 "notes": [
  "Owner-approved roadmap §4.6 (FIN-006 policy register): aggregate by stable catalogItemId + normalized unit (never display name); final-only core with final/estimated/incomplete separation; missing identity or incompatible units excluded with visible reasons; recorded-margin wording; no price/stop recommendations; catalog optional.",
  "Reopen gate: FIN-006 DEFERRED→READY via the owner roadmap execution order (WS-174 precedent recorded in status_history); gate_classification stays DEPENDENCY_GATE_REQUIRED_BEFORE_PILOT.",
  "W5-AUDIT verdict: AUDIT_PASS — recurringWorkService already provides identity keying + recorded margins + final-only; the wave completes the union: status separation, missing-identity visible exclusion (null + dangling), unit-incompatible visible exclusion; extends the canonical path in place (no second revenue/cost math path; margins stay recorded values).",
  "Surface: CatalogReadingsSection inside the collapsed details (density-free zone per the §10.1 collapsed-details rule — Catalog cap 93/93 unchanged; OPS-004 precedent).",
  "Schema/export unchanged 37/29; no new store; read-derived only.",
  "Baseline: verified main 83197b1 (Wave 4 closed; FIN-004 VERIFIED at 92bc58a)."
 ],
 "status_history": [
  {
   "status": "CLAIMED",
   "changed_at": "2026-09-23",
   "actor": "claim:ws-177",
   "reason": "Owner-approved financial roadmap Wave 5 (FIN-006) claimed per Operations Control v2 from verified main 83197b1c214f25a400ed81f88823d2221fd5ae83; execution map Wave 5 row; read-only audit W5-AUDIT passed."
  },
  {
   "status": "IN_PROGRESS",
   "changed_at": "2026-09-23",
   "actor": "ws-177:implement",
   "reason": "Implementation complete: canonical separation + visible unlinked exclusion on the identity-keyed path + surface display inside collapsed details."
  },
  {
   "status": "IN_REVIEW",
   "changed_at": "2026-09-23",
   "actor": "ws-177:review",
   "reason": "8 focused tests + full pipeline green (465 root + 1865 prototype + build/budget 649919/650000 after entry-bundle compaction); ready for PR and merge gate."
  }
 ],
 "migration_baseline": false
}