{
 "id": "WS-222",
 "title": "المتابعة الموحدة R11 — إصلاحا ARCH-012-NF-001/002 + تفعيل W2b + إغلاق D-12/F-040 + مصالحة Tracker",
 "status": "IN_REVIEW",
 "items": [
  "ARCH-012",
  "ARCH-013",
  "DOC-006"
 ],
 "branch": "remediation/r11-nf001-nf002-w2b-d12-20261016",
 "base_sha": "cb3b9aaae16b2e6336a6b831d2c1de8cf3603acf",
 "areas": [
  "apps/prototype-web/client/src/pages",
  "apps/prototype-web/client/src/application/transfers",
  "apps/prototype-web/client/src/application/drafts",
  "docs/architecture",
  "docs/operations",
  "docs"
 ],
 "contracts": [
  "AGENTS.md",
  "https://github.com/Qays7753/Micro/blob/b0aa8d8b9acbb98d6c262bc76851405936db0112/docs/architecture/refactoring/r11-unified-followup-20261016/R11-UNIFIED-FOLLOWUP-EXECUTION-PROMPT-2026-10-16.md",
  "docs/contracts/36-form-drafts-local-boundary-contract.md",
  "docs/contracts/39-export-envelope-integrity-contract.md",
  "docs/quality/security-boundaries.md",
  "docs/architecture/SOURCE_OF_TRUTH.md"
 ],
 "agent": "ZAI sequential executor (one writer; five read-only reviewers RV1-RV5 after implementation before final readiness)",
 "started_at": "2026-10-16",
 "updated_at": "2026-10-16",
 "next_action": "تنفيذ عقد المتابعة الموحدة بالترتيب: NF-001 ثم NF-002 ثم W2b (بالحمولة المعتمدة) ثم إغلاق D-12/F-040 ثم المصالحة الكاملة والبوابة والمراجعات الخمسة والدفع وPR واحد مفتوح.",
 "notes": [
  "Claim أُنشئ قبل أي تعديل كود وفق AGENTS.md §14؛ صفر Claims نشطة عند الإنشاء (ACTIVE-WORK فارغ؛ آخر Claim WS-221 مغلق VERIFIED).",
  "الأساس المتحقق: origin/main = cb3b9aaae16b2e6336a6b831d2c1de8cf3603acf (git fetch + GitHub API تطابقًا تامًا؛ STATE_DRIFT=NONE).",
  "العقد الحاكم مثبت على b0aa8d8b عبر PR #371 (docs فقط) وقُرئ كاملًا؛ الجرد المجمد قبل أول كتابة في evidence/R11-UNIFIED-FOLLOWUP-BASELINE-2026-10-16.md.",
  "حدود صارمة: لا New Design ولا UI بصري ولا Schema 38/Export 30/Legacy/Goldens/MANIFEST ولا دلالات مالية/تاريخية ولا عمل بنيوي؛ لا دمج ولا force-push ولا حذف فروع/PRs."
 ],
 "pr": 372,
 "status_history": [
  {
   "status": "CLAIMED",
   "changed_at": "2026-10-16",
   "actor": "zai-executor",
   "reason": "فتح Claim قبل أي تعديل كود وفق AGENTS.md §14 من الأساس المتحقق cb3b9aaae16b2e6336a6b831d2c1de8cf3603acf؛ صفر Claims نشطة عند الفتح (آخر Claim WS-221 مغلق VERIFIED)."
  },
  {
   "status": "IN_PROGRESS",
   "changed_at": "2026-10-16",
   "actor": "zai-executor",
   "reason": "الجرد المجمد قبل أول كتابة اكتمل (evidence/R11-UNIFIED-FOLLOWUP-BASELINE-2026-10-16.md) وبدء تنفيذ عقد المتابعة الموحدة بالترتيب المعتمد."
  },
  {
   "status": "IN_REVIEW",
   "changed_at": "2026-10-16",
   "actor": "zai-executor",
   "reason": "التنفيذ الكامل على PR #372 (رأس الكود 2b6f9586: البوابة الكاملة EXIT 0 والجذر 948/948 والتطبيق 2,736/2,736 وlint 35 بالضبط)؛ السجلات النهائية تُدفع على الفرع نفسه — قرار الدمج للمالك."
  }
 ],
 "migration_baseline": false
}
