{
  "id": "WS-174",
  "title": "Financial Roadmap Wave 2 — FIN-002 optional expense budgets and goals (plan-not-event)",
  "status": "CLAIMED",
  "items": [
    "FIN-002"
  ],
  "branch": "feat/fin-002-budgets-goals-20260922",
  "base_sha": "e7c7b1c20890e64f98ad420ac008ef6578601c0f",
  "areas": [
    "domain/budget",
    "application/finance/budgets",
    "storage/local/expense-budgets",
    "presentation/finance-budgets"
  ],
  "contracts": [
    "docs/contracts/42-optional-expense-budgets-goals-contract.md",
    "docs/contracts/05-financial-p0-policies.md",
    "docs/contracts/08-expense-classification-prototype-contract.md",
    "docs/contracts/39-export-envelope-integrity-contract.md",
    "docs/contracts/41-recurring-expense-reminders-contract.md"
  ],
  "agent": "ZAI / Super Z Financial Roadmap controlled execution session 2026-09-22",
  "pr": null,
  "started_at": "2026-09-22T17:00:00+03:00",
  "updated_at": "2026-09-22T17:00:00+03:00",
  "next_action": "عقد ٤٢ أولاً (توثيق سياسات المالك المعتمدة §4.3 بنمط عقد ٤١)، ثم الدومين النقي، ثم المخزن المحروس 37/29 بقرار مالك موثق للترحيل (نمط D-037)، ثم الخدمة والواجهة والاختبارات — الميزانية خطة لا حدث مالي أبدًا: الإنشاء/التعديل/التجاوز لا يغير كاشًا ولا نتيجة ولا دينًا ولا تاريخًا.",
  "notes": [
    "Owner-approved roadmap: 'Micro Financial Roadmap Complete Controlled Execution' (2026-09-22) §4.3 — the policy register for budgets/goals is owner-approved product decision.",
    "Reopen gate: FIN-002 DEFERRED→READY via the owner roadmap execution order (recorded in status_history); gate_classification stays DEPENDENCY_GATE_REQUIRED_BEFORE_PILOT.",
    "Schema/export bump 36/28 → 37/29 required (new persistent entity; preferences charter forbids financial-adjacent content) — guarded triple-diff per D-037/OPS-003 precedent; owner decision to be recorded in the PR.",
    "Bundle headroom ~4.9KB raw: the budget service must load dynamically post-startup per EXE-014/D-034 precedent (recurringExpenseService pattern).",
    "Baseline: verified main e7c7b1c (Wave 1 closed; FIN-003/007 VERIFIED)."
  ],
  "status_history": [
    {
      "status": "CLAIMED",
      "changed_at": "2026-09-22",
      "actor": "claim:ws-174",
      "reason": "Owner-approved financial roadmap Wave 2 (FIN-002) claimed per Operations Control v2 from verified main e7c7b1c20890e64f98ad420ac008ef6578601c0f; execution map: reports/agent-report/2026-09-22_financial-roadmap-phase-0-baseline/execution-map.md."
    }
  ],
  "migration_baseline": false,
  "evidence": [
    "reports/agent-report/2026-09-22_financial-roadmap-phase-0-baseline/execution-map.md"
  ]
}
