{"id":"WS-141","title":"Legacy PR #141 direct-sale review","status":"SUPERSEDED","items":["CLEAN-001"],"branch":"legacy-pr-141","base_sha":"97ce7fe","areas":["direct-sale"],"contracts":[],"agent":"unknown legacy session","pr":141,"started_at":"2026-09-01T00:00:00Z","updated_at":"2026-09-30T20:05:00Z","next_action":"لا إجراء؛ PR #141 مغلق والفرع القديم حُذف بعد إثبات أن direct-sale موجود ومطور على main الحالي.","notes":["PR قديمة وغير قابلة للدمج على خط أساس قديم.","أُغلق PR #141 كـsuperseded بعد إثبات أن direct-sale موجود ومطور على main الحالي؛ لا دمج للفرع القديم.","حُذف الفرع في موجة تنظيف 2026-09-30؛ لم يُحذف أي كود من main."],"status_history":[{"status":"REVIEW_REQUIRED","changed_at":"2026-09-19","actor":"migration:operations-control-v2","reason":"إضافة سجل الحالة عند ترحيل النظام إلى v2."},{"status":"SUPERSEDED","changed_at":"2026-09-19","actor":"legacy-reconciliation","reason":"أُغلق PR #141 كـsuperseded بعد إثبات أن direct-sale موجود ومطور على main الحالي؛ لا دمج للفرع القديم."}],"migration_baseline":true}
