{
  "id": "WS-183",
  "title": "UX-001 استمرار Phase 2 — تنفيذ الاتجاه البصري V2 على كامل سطح Micro الحقيقي: المكونات المشتركة والقشرة والشاشات حالة بحالة",
  "status": "VERIFIED",
  "items": [
    "UX-001"
  ],
  "branch": "feat/ux-001-v2-micro-full-surface-20260924",
  "base_sha": "f2d5aa60cd6805ff4f9acc104fd65f94bfb8d5a2",
  "areas": [
    "ui",
    "ux",
    "design-system",
    "presentation"
  ],
  "contracts": [
    "docs/architecture/SOURCE_OF_TRUTH.md",
    "docs/architecture/CHANGE_PROTOCOL.md",
    "docs/architecture/UI_AUX_ARCHITECTURE.md",
    "docs/architecture/COMPONENT_CONTRACTS.md",
    "docs/architecture/MIGRATION_STATUS.md"
  ],
  "agent": "Z AI — UX-001 Phase 2 continuation session 2026-09-24",
  "pr": 236,
  "started_at": "2026-09-24T18:43:08+03:00",
  "updated_at": "2026-09-24T19:13:29+03:00",
  "next_action": "WS-183 مدموج ومتحقق على main عند 6fdfe32c340e6dd3bb65851ed64192b0476d81e9: PR #236، CI وCloudflare ناجحان، وpnpm check على main بعد الدمج ناجح. أُغلق نطاق هذه الموجة فقط: تكيف CSS/الأساسات المشتركة وحدود الحقول وهالة التركيز وإصلاح أزرار الأيقونات وقاعدة القوائم والتوحيد وإزالة القواعد الميتة. لا يُرفع UX-001 إلى VERIFIED؛ تبقى بوابات الجهاز الحقيقي وTalkBack/VoiceOver وUAT والنطاقات المؤجلة بوابات لاحقة.",
  "notes": [
    "التفويض: مهمة المالك 2026-09-24 (Continue UX-001: merge the verified foundation then complete Micro UI/UX) — دمج PR #235 تم عبر بوابة PR الكاملة، وهذا الـ Claim هو استمرار التنفيذ على main بعد الدمج.",
    "النطاق: تكيف بصري/تفاعلي حقيقي داخل مكونات Micro وشاشاتها القائمة — تعديل المكوّن المشترك مرة واحدة وترحيل مستهلكيه، بلا مكونات V2* موازية ولا مصدر توكنز ثانٍ ولا نسخ Studio؛ حالات العرض كاملة (فراغ/تحميل/جزئي/غير متاح/خطأ/أوفلاين) بما يخدم غرض كل شاشة الحقيقي؛ قشرة وتنقل ضمن عقود المسارات الحالية فقط.",
    "خارج النطاق عمدًا: أي تغيير Domain/Storage/Export/Schema (38/30 كما هي)، أي كلمة حالة مجمدة أو منسق مالي أو معنى مالي، أي مسار/ميزة منتج جديدة غير موجودة، أي إعادة تصميم Dark Mode، أي رفع سقوف (lint 37، الحزمة 650,000/155,000) — أي تجاوز يوقف ويُرفع للمالك.",
    "حد الاستعادة: الأساس bbac8525 عبر WS-182 المدموج (Squash f2d5aa6) — عكس الأساسات عبر عكس التزام الدمج على main؛ موجة الاستمرار كلها التزامات مستقلة قابلة للعكس على هذا الفرع.",
    "بوابات التحقق الخارجية تبقى: جهاز حقيقي/TalkBack/UAT (DEVICE-001/UAT-001) — لا تُدّعى دون تنفيذ.",
    "اكتمال التنفيذ (2026-09-24): موجة CSS واحدة على الطبقات المشتركة فوق الأساسات المدموجة f2d5aa6 — بلا أي تعديل TSX (الحزمة خام 649,628 بايت مطابقة حرفيًا). حددّت الجسر بتوكن واحد جديد (--vf-info-surface #DFEDF1 من V2 حرفيًا) مع إعادة ربط حفظ في الداكن؛ أُعيد تحديد مجموعة التوكنز المعتمدة في vf-tokens.test كأثر تفويض موثق (CHANGE_PROTOCOL §1.4/§4).",
    "PR #236 مفتوح للمراجعة (الرأس 68a28a4bd48f من f2d5aa6) — الدمج يحتاج تفويض مالك منفصل لهذا الـ PR تحديدًا."
  ],
  "status_history": [
    {
      "status": "CLAIMED",
      "changed_at": "2026-09-24",
      "actor": "claim:ws-183",
      "reason": "فتح Claim استمرار UX-001 Phase 2 من main بعد الدمج f2d5aa6 (WS-182 VERIFIED لنطاق الأساسات) بتفويض المالك الصريح في مهمة الاستمرار 2026-09-24 — تنفيذ السطح الكامل."
    },
    {
      "status": "IN_REVIEW",
      "changed_at": "2026-09-24T17:11:24Z",
      "actor": "ws-183:review",
      "reason": "PR #236 مفتوح بنطاق واضح وفحوص CI وCloudflare ناجحة، وبوابة مراجعة الدمج مستوفاة."
    },
    {
      "status": "MERGED_UNVERIFIED",
      "changed_at": "2026-09-24T17:11:24Z",
      "actor": "ws-183:merge",
      "reason": "PR #236 دُمج Squash إلى main عند 6fdfe32c340e6dd3bb65851ed64192b0476d81e9 بعد بوابة الدمج الدقيقة."
    },
    {
      "status": "VERIFIED",
      "changed_at": "2026-09-24T17:11:24Z",
      "actor": "ws-183:post-merge-verification",
      "reason": "على main الفعلي 6fdfe32c340e6dd3bb65851ed64192b0476d81e9: CI وCloudflare ناجحان، وفحوص الحوكمة وpnpm check تثبت نطاق الموجة. VERIFIED لنطاق WS-183 فقط؛ UX-001 لا تزال غير مغلقة."
    }
  ],
  "migration_baseline": false,
  "evidence": [
    "docs/operations/control/evidence/ui-v2-phase2-implementation-2026-09-24.md",
    "docs/operations/control/evidence/ui-v2-phase0-baseline-2026-09-23.md",
    "docs/operations/control/evidence/ui-v2-phase1-closeout-2026-09-24.md",
    "docs/operations/control/evidence/ui-v2-ws183-full-surface-2026-09-24.md"
  ],
  "merge_sha": "6fdfe32c340e6dd3bb65851ed64192b0476d81e9",
  "verified_on_main_sha": "6fdfe32c340e6dd3bb65851ed64192b0476d81e9"
}
