{
  "id": "WS-180",
  "title": "Financial Roadmap Wave 8 — CLEAN-001 dead/partial-surface surgical audit (zero-deletion outcome pinned with honesty guards)",
  "status": "VERIFIED",
  "items": [
    "CLEAN-001"
  ],
  "branch": "feat/clean-001-surface-audit-20260923",
  "base_sha": "b68ea31b84574d48217aface8e056d5ac6aebe63",
  "areas": [
    "routes",
    "product-surfaces",
    "quality/audit-evidence"
  ],
  "contracts": [
    "docs/contracts/05-financial-p0-policies.md"
  ],
  "agent": "ZAI / Super Z Financial Roadmap controlled execution session 2026-09-23",
  "pr": 226,
  "started_at": "2026-09-23T11:00:00+03:00",
  "updated_at": "2026-09-23",
  "next_action": "لا فعل إضافي: الموجة ٨ مكتملة (صفر حذف). البوابة التالية فقط: الموجة ٩ (REL-001 فجوات الصمود).",
  "notes": [
    "Owner rules (roadmap §5 Wave 8): surgical cleanup ONLY after all executable financial waves verified (FIN-003/007, 002, 005, 004, 006, 001, 008 — ALL VERIFIED on main). No bulk moves, no new features/ layer, no structural refactor, no deletion of historical evidence, no semantic change. Every deletion listed with reason/reference-search result/risk/rollback. Structural temptation => OWNER_DECISION_REQUIRED under the post-Group-6 gate.",
    "Coordinator audit findings (read-only): the Phase-0 candidate inventory (/market honest placeholder, AppHeader soon panels, CashWallets conditional copy) all meet the acceptance bar TODAY — /market is an honest NAV-001-approved 'قريبًا' surface with NO service/store/localStorage imports (writes nothing); AppHeader panels are documented honest announcements (no reservation/tracking/pricing); CashWallets conditional copy is functional return-path copy. Zero unreferenced non-test components (reference scan). routeKnowledgeSync already pins every route classified with no orphans either direction.",
    "Honest outcome: ZERO deletions (NO_UNAUTHORIZED_CLEANUP_PERFORMED) — inventing deletions would violate the no-semantic-change rule. The wave delivers the audit evidence + focused guard tests pinning the honesty invariants (coming-soon surfaces write no data) so regressions are caught."
  ],
  "status_history": [
    {
      "status": "CLAIMED",
      "changed_at": "2026-09-23",
      "actor": "ws-180:claim",
      "reason": "Claim تنفيذي واحد غير متداخل فوق main المتحقق b68ea31 (كل الموجات المالية القابلة للتنفيذ متحققة)."
    },
    {
      "status": "IN_PROGRESS",
      "changed_at": "2026-09-23",
      "actor": "ws-180:implement",
      "reason": "جرد الأسطح المرشحة وتثبيت أمانة إعلانات قريبًا بحدس حارسة."
    },
    {
      "status": "IN_REVIEW",
      "changed_at": "2026-09-23",
      "actor": "ws-180:review",
      "reason": "جرد موثق بصفر حذف + 4 حدس حارسة لأمانة الأسطح — جاهز لبوابة PR."
    },
    {
      "status": "MERGED_UNVERIFIED",
      "changed_at": "2026-09-23",
      "actor": "ws-180:merge",
      "reason": "PR #226 مدمج Squash عند ef54dcf (الأساس b68ea31)."
    },
    {
      "status": "VERIFIED",
      "changed_at": "2026-09-23",
      "actor": "ws-180:post-merge-verification",
      "reason": "تحقق على SHA الدمج نفسه ef54dcf: CI + Cloudflare ناجحان؛ الحدس 4/4 على main."
    }
  ],
  "migration_baseline": false,
  "merge_sha": "ef54dcfbb1e3191d95f6354b46115c0d627e42e0",
  "verified_on_main_sha": "ef54dcfbb1e3191d95f6354b46115c0d627e42e0",
  "evidence": [
    "reports/agent-report/2026-09-23_fin-roadmap-wave-8-clean-001/report.md"
  ]
}
