{
  "id": "WS-198",
  "title": "REM-004 — W4-C سجل التغيير التعويضي + امتداد فئة F-036 (F-037 + PRs #190–#205)",
  "status": "VERIFIED",
  "items": [
    "REM-004"
  ],
  "branch": "fix/w4c-changelog-backfill-20260929",
  "base_sha": "ed0c703af1172a2a8b08414f55856aaa2255e098",
  "areas": [
    "docs"
  ],
  "contracts": [
    "docs/operations/control/evidence/micro-master-remediation-2026-09-27/MICRO-MASTER-REMEDIATION-CHARTER-AR.md"
  ],
  "agent": "Z AI — master remediation program 2026-09-29 (Wave 4, slice C)",
  "pr": 268,
  "started_at": "2026-09-29T16:00:00+03:00",
  "updated_at": "2026-09-29T17:00:00+03:00",
  "next_action": "لا إجراء إضافي؛ شريحة W4-C متحققة على main 46f51d0 (تطابق الشجرة مع رأس PR).",
  "status_history": [
    {
      "status": "CLAIMED",
      "changed_at": "2026-09-29",
      "actor": "claim:ws-198",
      "reason": "فتح Claim لشريحة W4-C من origin/main ed0c703 بعد إغلاق WS-197 VERIFIED (تطابق الشجرة)."
    },
    {
      "status": "IN_REVIEW",
      "changed_at": "2026-09-29",
      "actor": "pr:268",
      "reason": "اكتمل تنفيذ W4-C وافتُتح PR #268 ببوابات خضراء على الرأس 43269d7."
    },
    {
      "status": "MERGED_UNVERIFIED",
      "changed_at": "2026-09-29",
      "actor": "merge:pr-268",
      "reason": "دُمج PR #268 (Squash) عند 46f51d0fc2f5defe33d87431db7987e0dbfb04ab بعد Merge Manifest."
    },
    {
      "status": "VERIFIED",
      "changed_at": "2026-09-29",
      "actor": "verify:main-tree",
      "reason": "تطابق الشجرة (فرق فارغ 43269d7..main — CI الرأس الأخضر يثبتها)؛ التحقق المباشر: السجل التعويضي حاضر في CHANGELOG، صفر «PR #N مفتوح» في current-state، validate EXIT 0."
    }
  ],
  "migration_baseline": false,
  "notes": [
    "النطاق: CHANGELOG.md + تصحيحات current-state §41–§57 فقط — توثيق صرف، صفر كود تشغيل، صفر حزمة، صفر مخطط/تصدير، لا اختبارات جديدة.",
    "حد الاستعادة: ed0c703.",
    "اكتشاف داخل الشريحة: 8 ادعاءات دمج زائفة من فئة F-036 نفسها (غير مقيدة باختبارات) في current-state §41–§57 — نفس نمط التصحيح المؤرخ."
  ],
  "evidence": [
    "docs/operations/control/items/REM-004.json",
    "docs/operations/control/evidence/micro-master-remediation-2026-09-27/W4C-SLICE-REPORT-2026-09-29.md",
    "https://github.com/Qays7753/Micro/pull/268"
  ],
  "merge_sha": "46f51d0fc2f5defe33d87431db7987e0dbfb04ab",
  "verified_on_main_sha": "46f51d0fc2f5defe33d87431db7987e0dbfb04ab"
}
