{
  "id": "WS-209",
  "title": "تنفيذ الدفعة المحذوفة وتقاعد ملفات التقارير المساندة — الجولة الثانية من تدقيق الحد الأدنى",
  "status": "VERIFIED",
  "items": [
    "DOC-004"
  ],
  "branch": "docs/surface-cleanup-r2-20261002",
  "base_sha": "43058d61ec1eb1550809d89aeceec76e8b30283b",
  "areas": [
    "docs/operations/archive/quality-history",
    "docs/operations/control/evidence",
    "reports/agent-report",
    "documentation-governance"
  ],
  "contracts": [],
  "agent": "Z AI coordination agent (Round-2 cleanup execution)",
  "pr": 291,
  "started_at": "2026-10-02",
  "updated_at": "2026-10-02",
  "next_action": "لا إجراء إضافي؛ منفذ ومتحقق على main عند 20041318.",
  "status_history": [
    {
      "status": "CLAIMED",
      "changed_at": "2026-10-02",
      "actor": "ws-209:claim",
      "reason": "فتح Claim على الفرع docs/surface-cleanup-r2-20261002 من main المتحقق 43058d61ec1eb1550809d89aeceec76e8b30283b بعد التحقق من صفر Workstreams نشطة وصفر PRs مفتوحة وصفر تعارض نطاقات."
    },
    {
      "status": "IN_PROGRESS",
      "changed_at": "2026-10-02",
      "actor": "ws-209:implement",
      "reason": "تنفيذ الحذف والتقاعد مع فحوص مرجعية صفرية معاد تشغيلها عند رأس التنفيذ الحي."
    },
    {
      "status": "IN_REVIEW",
      "changed_at": "2026-10-02",
      "actor": "ws-209:review",
      "reason": "فُتح PR #291 على الفرع docs/surface-cleanup-r2-20261002 برأس d84e91c6 بعد نجاح كل الفحوص المحلية (الحراس السبعة + validate + views)."
    },
    {
      "status": "MERGED_UNVERIFIED",
      "changed_at": "2026-10-02",
      "actor": "merge:pr-291",
      "reason": "دُمج PR #291 بطريقة Squash عند 200413187002bbada752586f1d12f41308420bfc بعد نجاح CI (Actions + Cloudflare Pages) على رأس الـPR النهائي (بعد دمج إصلاح audit البنيوي PR #292 في الفرع)."
    },
    {
      "status": "VERIFIED",
      "changed_at": "2026-10-02",
      "actor": "verify:main-tree",
      "reason": "تطابق رأس origin/main مع merge_sha 200413187002bbada752586f1d12f41308420bfc؛ المدقق صالح (77 بندًا/51 Workstream) والViews حالية؛ الملفات المحذوفة غائبة والأساسيات الباقية حاضرة على main؛ صفر إحالات حية متروكة."
    }
  ],
  "migration_baseline": false,
  "notes": [
    "قرار المالك الموثق في محفظة الجولة الثانية (OD matrix): DELETE-42 + aux-94 (واحد مستثنى run-main). حد الاستعادة: git revert لدمجة الـPR؛ تاريخ git عند 43058d61 يحفظ كل محتوى محذوف."
  ],
  "evidence": [
    "docs/operations/control/evidence/documentation-context-cleanup-2026-10-02/ROUND-2-FINAL-EXECUTION-REPORT.md"
  ],
  "merge_sha": "200413187002bbada752586f1d12f41308420bfc",
  "verified_on_main_sha": "200413187002bbada752586f1d12f41308420bfc"
}